{
  "counts_by_disposition": {
    "blocked_not_wired": 11,
    "blocked_requires_model_and_calibration": 16,
    "fixed_structural_choice": 11,
    "include_range_finding": 12,
    "model_limitation": 1,
    "observation_only": 2,
    "response_or_derived_input": 6,
    "separate_accuracy_study": 5,
    "separate_mask_erosion_block": 2
  },
  "factor_count": 66,
  "factors": [
    {
      "classification": "product_specification",
      "coupling_note": null,
      "disposition": "response_or_derived_input",
      "implementation_locator": null,
      "implementation_status": "output_target",
      "known_interactions": [],
      "name": "opening radius",
      "owner_api": "program.md / tsv_process.TARGET_SPECS",
      "range_provenance": "Declared study target retained for continuity; physical-unit and tolerance provenance remain uncalibrated.",
      "reason": "Comparison target or value derived from another input; do not count it as an independent factor.",
      "registry_doe_eligibility": "not_a_tuning_factor",
      "registry_id": "pattern_radius_spec",
      "responses_expected_to_change": [
        "top_cd",
        "bottom_cd",
        "aspect_ratio"
      ],
      "tutorial_role": "assumed_study_target"
    },
    {
      "classification": "product_specification",
      "coupling_note": null,
      "disposition": "response_or_derived_input",
      "implementation_locator": null,
      "implementation_status": "output_target",
      "known_interactions": [],
      "name": "opening width",
      "owner_api": "program.md / tsv_process.TARGET_SPECS",
      "range_provenance": "Declared study target retained for continuity; physical-unit and tolerance provenance remain uncalibrated.",
      "reason": "Comparison target or value derived from another input; do not count it as an independent factor.",
      "registry_doe_eligibility": "not_a_tuning_factor",
      "registry_id": "pattern_width_spec",
      "responses_expected_to_change": [
        "top_cd",
        "bottom_cd",
        "cd_bias"
      ],
      "tutorial_role": "assumed_study_target"
    },
    {
      "classification": "product_specification",
      "coupling_note": null,
      "disposition": "response_or_derived_input",
      "implementation_locator": null,
      "implementation_status": "output_target",
      "known_interactions": [],
      "name": "pattern-mask height",
      "owner_api": "program.md / tsv_process.TARGET_SPECS",
      "range_provenance": "Declared study target retained for continuity; physical-unit and tolerance provenance remain uncalibrated.",
      "reason": "Comparison target or value derived from another input; do not count it as an independent factor.",
      "registry_doe_eligibility": "not_a_tuning_factor",
      "registry_id": "pattern_mask_height_spec",
      "responses_expected_to_change": [
        "mask_height",
        "mask_remaining"
      ],
      "tutorial_role": "assumed_study_target"
    },
    {
      "classification": "product_specification",
      "coupling_note": null,
      "disposition": "response_or_derived_input",
      "implementation_locator": null,
      "implementation_status": "output_target",
      "known_interactions": [],
      "name": "target etch depth",
      "owner_api": "program.md / tsv_process.TARGET_SPECS",
      "range_provenance": "Declared study target retained for continuity; physical-unit and tolerance provenance remain uncalibrated.",
      "reason": "Comparison target or value derived from another input; do not count it as an independent factor.",
      "registry_doe_eligibility": "not_a_tuning_factor",
      "registry_id": "etch_depth_spec",
      "responses_expected_to_change": [
        "depth",
        "aspect_ratio"
      ],
      "tutorial_role": "assumed_study_target"
    },
    {
      "classification": "product_specification",
      "coupling_note": null,
      "disposition": "response_or_derived_input",
      "implementation_locator": null,
      "implementation_status": "output_target",
      "known_interactions": [],
      "name": "CD-profile tolerance",
      "owner_api": "program.md / tsv_process.TARGET_SPECS",
      "range_provenance": "Declared study target retained for continuity; physical-unit and tolerance provenance remain uncalibrated.",
      "reason": "Comparison target or value derived from another input; do not count it as an independent factor.",
      "registry_doe_eligibility": "not_a_tuning_factor",
      "registry_id": "etch_cd_tolerance_spec",
      "responses_expected_to_change": [
        "entrance_cd",
        "mid_cd",
        "bottom_cd",
        "cd_profile_error"
      ],
      "tutorial_role": "assumed_study_target"
    },
    {
      "classification": "product_specification",
      "coupling_note": null,
      "disposition": "response_or_derived_input",
      "implementation_locator": null,
      "implementation_status": "output_target",
      "known_interactions": [],
      "name": "maximum wall bow",
      "owner_api": "program.md / tsv_process.TARGET_SPECS",
      "range_provenance": "Declared study target retained for continuity; physical-unit and tolerance provenance remain uncalibrated.",
      "reason": "Comparison target or value derived from another input; do not count it as an independent factor.",
      "registry_doe_eligibility": "not_a_tuning_factor",
      "registry_id": "etch_bow_spec",
      "responses_expected_to_change": [
        "wall_bow",
        "sidewall_taper"
      ],
      "tutorial_role": "assumed_study_target"
    },
    {
      "classification": "structural_choice",
      "coupling_note": null,
      "disposition": "include_range_finding",
      "implementation_locator": {
        "argument": "taper",
        "callable": "make_initial_geometry",
        "code_path": "tsv_process.py",
        "config_key": "defaults.geometry.mask_taper"
      },
      "implementation_status": "wired_model_acceptance_candidate",
      "known_interactions": [
        "mask_taper x stochastic ray sampling"
      ],
      "name": "mask_taper",
      "owner_api": "make_initial_geometry(taper) / MakeHole.maskTaperAngle",
      "range_provenance": "Model-sensitivity range assembled from wrapper defaults and earlier simulations; no fab calibration.",
      "reason": "Implemented control; qualify its model-space range before screening.",
      "registry_doe_eligibility": "range_requalification_required",
      "registry_id": "phase_factor_mask_taper",
      "responses_expected_to_change": [
        "top_cd",
        "mask_sidewall_angle",
        "etch_variance"
      ],
      "tutorial_role": "geometry_input"
    },
    {
      "classification": "recipe_knob",
      "coupling_note": "Cycle count changes cumulative etch, polymer deposition, polymer removal, and random-stream length. Use a matched-total-dose block or predeclare its cumulative-dose interactions before screening.",
      "disposition": "include_range_finding",
      "implementation_locator": {
        "argument": "num_cycles",
        "callable": "bosch_etch",
        "code_path": "tsv_process.py",
        "config_key": "defaults.bosch.num_cycles"
      },
      "implementation_status": "wired_model_acceptance_candidate",
      "known_interactions": [
        "num_cycles x etch_time",
        "num_cycles x deposition_thickness"
      ],
      "name": "num_cycles",
      "owner_api": "bosch_etch(num_cycles)",
      "range_provenance": "Model-sensitivity range assembled from wrapper defaults and earlier simulations; no fab calibration.",
      "reason": "Implemented control; qualify its model-space range before screening.",
      "registry_doe_eligibility": "range_requalification_required",
      "registry_id": "phase_factor_num_cycles",
      "responses_expected_to_change": [
        "depth",
        "scallop_period",
        "wall_bow"
      ],
      "tutorial_role": "effective_model_control"
    },
    {
      "classification": "recipe_knob",
      "coupling_note": null,
      "disposition": "include_range_finding",
      "implementation_locator": {
        "argument": "etch_time",
        "callable": "bosch_etch",
        "code_path": "tsv_process.py",
        "config_key": "defaults.bosch.etch_time"
      },
      "implementation_status": "wired_model_acceptance_candidate",
      "known_interactions": [
        "etch_time x deposition_thickness",
        "etch_time x num_cycles",
        "etch_time x neutral_rate"
      ],
      "name": "etch_time",
      "owner_api": "bosch_etch(etch_time) / Process.duration",
      "range_provenance": "Model-sensitivity range assembled from wrapper defaults and earlier simulations; no fab calibration.",
      "reason": "Implemented control; qualify its model-space range before screening.",
      "registry_doe_eligibility": "range_requalification_required",
      "registry_id": "phase_factor_etch_time",
      "responses_expected_to_change": [
        "depth",
        "etch_rate",
        "wall_bow",
        "cd_profile"
      ],
      "tutorial_role": "effective_model_control"
    },
    {
      "classification": "model_coefficient",
      "coupling_note": null,
      "disposition": "include_range_finding",
      "implementation_locator": {
        "argument": "neutral_rate",
        "callable": "bosch_etch",
        "code_path": "tsv_process.py",
        "config_key": "defaults.bosch.neutral_rate"
      },
      "implementation_status": "wired_model_acceptance_candidate",
      "known_interactions": [
        "neutral_rate x etch_time",
        "neutral_rate x neutral_sticking_probability"
      ],
      "name": "neutral_rate",
      "owner_api": "bosch_etch rate_fn neutral coefficient",
      "range_provenance": "Model-sensitivity range assembled from wrapper defaults and earlier simulations; no fab calibration.",
      "reason": "Implemented control; qualify its model-space range before screening.",
      "registry_doe_eligibility": "range_requalification_required",
      "registry_id": "phase_factor_neutral_rate",